{
  "schema_version": "1.0.0",
  "reproduction_version": "baro-repro-12f5028-r1",
  "source_commit": "f11e8e8",
  "public_commit": "12f5028",
  "generated_at": "2026-06-07T09:53:57Z",
  "artifacts": [
    {
      "role": "oneway_stage1_model",
      "filename": "oneway_stage1_random_forest.pkl",
      "bundle_path": "models/baro-runtime-v1/oneway_stage1_random_forest.pkl",
      "restore_path": "models/baro-runtime-v1/oneway_stage1_random_forest.pkl",
      "size_bytes": 1964511297,
      "sha256": "bd5f468e8329e23708eb3e4cf428516a7716c00ea2c3bc84c8057aef15c82f15",
      "required": true,
      "category": "model",
      "trip_type": "oneway",
      "format": "pkl",
      "compression": null,
      "compressed_size_bytes": null,
      "notes": "Confirmed by Phase 3.6-A.2 sanitized runtime evidence. Runtime paths are intentionally omitted.",
      "source_evidence": "phase3_6a2_model_live_inventory.csv",
      "runtime_loader": "backend/ml_inference/oneway_adapter.py; backend/ml_inference/model_status.py",
      "read_only": true,
      "status": "ready"
    },
    {
      "role": "oneway_stage2_model",
      "filename": "oneway_stage2_xgboost.pkl",
      "bundle_path": "models/baro-runtime-v1/oneway_stage2_xgboost.pkl",
      "restore_path": "models/baro-runtime-v1/oneway_stage2_xgboost.pkl",
      "size_bytes": 5248872,
      "sha256": "655d9933c24aebd2a17860de2998043ad21007f0aef312898e86d4baf7e9e963",
      "required": true,
      "category": "model",
      "trip_type": "oneway",
      "format": "pkl",
      "compression": null,
      "compressed_size_bytes": null,
      "notes": "Confirmed by Phase 3.6-A.2 sanitized runtime evidence. Runtime paths are intentionally omitted.",
      "source_evidence": "phase3_6a2_model_live_inventory.csv",
      "runtime_loader": "backend/ml_inference/oneway_adapter.py; backend/ml_inference/model_status.py",
      "read_only": true,
      "status": "ready"
    },
    {
      "role": "roundtrip_stage1_model",
      "filename": "roundtrip_stage1_xgboost.pkl",
      "bundle_path": "models/baro-runtime-v1/roundtrip_stage1_xgboost.pkl",
      "restore_path": "models/baro-runtime-v1/roundtrip_stage1_xgboost.pkl",
      "size_bytes": 11599370,
      "sha256": "f60e3ec787ecfca04d3d498dc4f2c6683075eab63bf73701b5663dbcef509b9a",
      "required": true,
      "category": "model",
      "trip_type": "roundtrip",
      "format": "pkl",
      "compression": null,
      "compressed_size_bytes": null,
      "notes": "Confirmed by Phase 3.6-A.2 sanitized runtime evidence. Runtime paths are intentionally omitted.",
      "source_evidence": "phase3_6a2_model_live_inventory.csv",
      "runtime_loader": "backend/ml_inference/model_runtime.py; backend/ml_inference/model_status.py",
      "read_only": true,
      "status": "ready"
    },
    {
      "role": "roundtrip_stage2_model",
      "filename": "roundtrip_stage2_xgboost.pkl",
      "bundle_path": "models/baro-runtime-v1/roundtrip_stage2_xgboost.pkl",
      "restore_path": "models/baro-runtime-v1/roundtrip_stage2_xgboost.pkl",
      "size_bytes": 3208908,
      "sha256": "b3895ac99fba15e4e9d1b07609258f1485b0f07437933f1eea8827d68319adfa",
      "required": true,
      "category": "model",
      "trip_type": "roundtrip",
      "format": "pkl",
      "compression": null,
      "compressed_size_bytes": null,
      "notes": "Confirmed by Phase 3.6-A.2 sanitized runtime evidence. Runtime paths are intentionally omitted.",
      "source_evidence": "phase3_6a2_model_live_inventory.csv",
      "runtime_loader": "backend/ml_inference/model_runtime.py; backend/ml_inference/model_status.py",
      "read_only": true,
      "status": "ready"
    },
    {
      "role": "feature_contract",
      "filename": "feature_columns.json",
      "bundle_path": "models/baro-runtime-v1/feature_columns.json",
      "restore_path": "models/baro-runtime-v1/feature_columns.json",
      "size_bytes": 1490,
      "sha256": "8eea88c29cfba4b2f6d86d36577902e73b222c21013e43a0e4d1f74a5f65697c",
      "required": true,
      "category": "metadata",
      "trip_type": "shared",
      "format": "json",
      "compression": null,
      "compressed_size_bytes": null,
      "notes": "Confirmed by Phase 3.6-A.2 sanitized runtime evidence. Runtime paths are intentionally omitted.",
      "source_evidence": "phase3_6a2_model_live_inventory.csv",
      "runtime_loader": "backend/ml_inference/model_runtime.py; backend/ml_inference/oneway_adapter.py",
      "read_only": true,
      "status": "ready"
    },
    {
      "role": "encoding_mapping",
      "filename": "enc_mappings.json",
      "bundle_path": "models/baro-runtime-v1/enc_mappings.json",
      "restore_path": "models/baro-runtime-v1/enc_mappings.json",
      "size_bytes": 6436,
      "sha256": "350989c55bbcfddfa8a38bd5d4b5d63db7f01f74d1a36b3b90ee6ca4e903d607",
      "required": true,
      "category": "metadata",
      "trip_type": "shared",
      "format": "json",
      "compression": null,
      "compressed_size_bytes": null,
      "notes": "Confirmed by Phase 3.6-A.2 sanitized runtime evidence. Runtime paths are intentionally omitted.",
      "source_evidence": "phase3_6a2_model_live_inventory.csv",
      "runtime_loader": "backend/ml_inference/model_runtime.py; backend/ml_inference/oneway_adapter.py; backend/ml_inference/roundtrip_feature_builder.py",
      "read_only": true,
      "status": "ready"
    },
    {
      "role": "oneway_threshold",
      "filename": "oneway_threshold.json",
      "bundle_path": "models/baro-runtime-v1/oneway_threshold.json",
      "restore_path": "models/baro-runtime-v1/oneway_threshold.json",
      "size_bytes": 564,
      "sha256": "0310e3f61420f15a0c4093099dab03d7ca3c9d39bceefe7f01541de219339aad",
      "required": true,
      "category": "metadata",
      "trip_type": "oneway",
      "format": "json",
      "compression": null,
      "compressed_size_bytes": null,
      "notes": "Confirmed by Phase 3.6-A.2 sanitized runtime evidence. Runtime paths are intentionally omitted.",
      "source_evidence": "phase3_6a2_model_live_inventory.csv",
      "runtime_loader": "backend/ml_inference/model_runtime.py; backend/ml_inference/oneway_adapter.py",
      "read_only": true,
      "status": "ready"
    },
    {
      "role": "roundtrip_threshold",
      "filename": "roundtrip_threshold.json",
      "bundle_path": "models/baro-runtime-v1/roundtrip_threshold.json",
      "restore_path": "models/baro-runtime-v1/roundtrip_threshold.json",
      "size_bytes": 618,
      "sha256": "89e0a0c0d8fe696d0172707400cd9b3c21ad50a4cd4822d155c2e5813788293d",
      "required": true,
      "category": "metadata",
      "trip_type": "roundtrip",
      "format": "json",
      "compression": null,
      "compressed_size_bytes": null,
      "notes": "Confirmed by Phase 3.6-A.2 sanitized runtime evidence. Runtime paths are intentionally omitted.",
      "source_evidence": "phase3_6a2_model_live_inventory.csv",
      "runtime_loader": "backend/ml_inference/model_runtime.py",
      "read_only": true,
      "status": "ready"
    },
    {
      "role": "oneway_metadata",
      "filename": "final_model_metadata.json",
      "bundle_path": "models/baro-runtime-v1/final_model_metadata.json",
      "restore_path": "models/baro-runtime-v1/final_model_metadata.json",
      "size_bytes": 3874,
      "sha256": "a62d47a79be9f9992c2f0196bb7ed3ea1a976a8ffc40b2f0c79b42d927481571",
      "required": true,
      "category": "metadata",
      "trip_type": "oneway",
      "format": "json",
      "compression": null,
      "compressed_size_bytes": null,
      "notes": "Confirmed by Phase 3.6-A.2 sanitized runtime evidence. Runtime paths are intentionally omitted.",
      "source_evidence": "phase3_6a2_model_live_inventory.csv",
      "runtime_loader": "backend/ml_inference/model_runtime.py; backend/ml_inference/oneway_adapter.py; backend/ml_inference/model_status.py",
      "read_only": true,
      "status": "ready"
    },
    {
      "role": "roundtrip_metadata",
      "filename": "roundtrip_final_model_metadata.json",
      "bundle_path": "models/baro-runtime-v1/roundtrip_final_model_metadata.json",
      "restore_path": "models/baro-runtime-v1/roundtrip_final_model_metadata.json",
      "size_bytes": 3894,
      "sha256": "db4b07e7b92aae5ea3054ef49b70f7d7e77f6bb407aeebb9783d6e5e3bf1babe",
      "required": false,
      "category": "metadata",
      "trip_type": "roundtrip",
      "format": "json",
      "compression": null,
      "compressed_size_bytes": null,
      "notes": "Confirmed by Phase 3.6-A.2 sanitized runtime evidence. Runtime paths are intentionally omitted.",
      "source_evidence": "phase3_6a2_model_live_inventory.csv",
      "runtime_loader": "backend/ml_inference/model_runtime.py fallback to final_model_metadata.json",
      "read_only": true,
      "status": "ready"
    }
  ],
  "database_snapshots": [
    {
      "tier": "minimal-repro",
      "filename": null,
      "schema_filename": null,
      "checksum": null,
      "status": "planned",
      "estimated_rows": null,
      "included_tables": [
        "search_observation",
        "flight_offer_observation"
      ],
      "excluded_data_classes": [
        "auth",
        "user",
        "token",
        "session",
        "bookmark",
        "settings",
        "raw_capture",
        "credentials",
        "private_path",
        "private_network"
      ],
      "restore_order": [
        "schema",
        "search_observation",
        "flight_offer_observation"
      ],
      "required": true,
      "category": "database"
    },
    {
      "tier": "extended-repro",
      "filename": null,
      "schema_filename": null,
      "checksum": null,
      "status": "planned",
      "estimated_rows": null,
      "included_tables": [
        "search_observation",
        "flight_offer_observation",
        "service_route_analysis_snapshot"
      ],
      "excluded_data_classes": [
        "auth",
        "user",
        "token",
        "session",
        "bookmark",